,Product Name,URL,Rating,Reviews,Price
161,"TRAWOC 55 LTR Travel Backpack Daypack bag for Camping Hiking Trekking, English Blue, SHK014",https://www.amazon.in/TRAWOC-Backpack-Outdoor-Trekking-Rucksack/dp/B07XY6BFXJ/ref=sr_1_120?keywords=bags&qid=1679381408&sr=8-120,4.2,"2,377","1,417"
162,Farraige® Cartoon Soft Silicone Bag Crossbody Shoulder Bag Purse Waterproof Anti Fall Stationery Storage Bag Handbag Sweet Birthday Gift for Children Students Girls,https://www.amazon.in/Farraige%C2%AE-Silicone-Crossbody-Waterproof-Stationery/dp/B0B4G8W6MQ/ref=sr_1_121?keywords=bags&qid=1679381408&sr=8-121,4.4,25,634
163,FUR JADEN 15.6 Anti Theft Laptop Backpack with USB Charging Port Unisex Bag for College Office Suitable for Men Women,https://www.amazon.in/FUR-JADEN-Waterproof-Charging-BM25_Grey/dp/B07FM9BSKW/ref=sr_1_122?keywords=bags&qid=1679381408&sr=8-122,4.0,"5,804",789
164,"uppercase Apex Professional Laptop Backpack (15.6 Inch) 3x more water resistant sustainable bags with rain proof zippers for Men, Women, Boys and Girls, 750 Days warranty",https://www.amazon.in/sspa/click?ie=UTF8&spc=MTozNTEyNjI0MjkyOTA2MjQyOjE2NzkzODE0MDg6c3BfbXRmOjIwMTA1NDUxODUxNTk4OjowOjo&url=%2Fuppercase-Professional-Backpack-resistant-sustainable%2Fdp%2FB0BR1D4SL1%2Fref%3Dsr_1_123_sspa%3Fkeywords%3Dbags%26qid%3D1679381408%26sr%3D8-123-spons%26sp_csd%3Dd2lkZ2V0TmFtZT1zcF9tdGY%26psc%3D1,4.9,17,"1,800"
165,Red Lemon Bange Hard Ironlook Briefcase Laptop Bag Anti-Theft Hard Shell Unisex Laptop Backpack with USB Charging Backpack for Men and Women,https://www.amazon.in/sspa/click?ie=UTF8&spc=MTozNTEyNjI0MjkyOTA2MjQyOjE2NzkzODE0MDg6c3BfbXRmOjIwMTI4MjU4Nzk2Njk4OjowOjo&url=%2FRed-Lemon-Ironlook-Briefcase-Anti-Theft%2Fdp%2FB09ZYMT7V1%2Fref%3Dsr_1_124_sspa%3Fkeywords%3Dbags%26qid%3D1679381408%26sr%3D8-124-spons%26sp_csd%3Dd2lkZ2V0TmFtZT1zcF9tdGY%26psc%3D1,4.3,61,"4,599"
166,KILLER Louis 38L Large Laptop Backpack With 3 Compartments Polyester Trendy Waterproof Travel Backpack,https://www.amazon.in/Killer-Backpack-Compartments-Polyester-Waterproof/dp/B07CDD6YS2/ref=sr_1_125?keywords=bags&qid=1679381408&sr=8-125,4.4,"11,117","1,664"
167,"Safari Sneak Casual Backpack with USB Charging Port 26 Ltrs Water Resistant Fabric - Grey, L (SNEAK19CBGRE)",https://www.amazon.in/Safari-Casual-Backpack-Charging-Resistant/dp/B09B2581S9/ref=sr_1_126?keywords=bags&qid=1679381408&sr=8-126,3.7,822,949
168,NIVIA String Bag/Drawstring Bag/Sports Bag Boys/Polyester String Bag/Kit Bags/Drawstring Sports Bag/Dori Backpack/Gym Bag/String Bag Men Waterproof/Drawstring Backpack (Sky Blue),https://www.amazon.in/Nivia-5177SB-Polyester-String-Blue/dp/B071XMLFTL/ref=sr_1_127?keywords=bags&qid=1679381408&sr=8-127,4.1,456,193
169,Wooum Sling Cross Body Bag/One Side Bag/Shoulder Bag/Office Business Messenger Bag/Money Bag for Men and Women - Water Resisitance,https://www.amazon.in/Wooum-Resisitance-Shoulder-Business-Messenger/dp/B0993Q72WD/ref=sr_1_128?keywords=bags&qid=1679381408&sr=8-128,4.0,615,328.
170,Safari Seek 45 Ltrs Overnighter Expandable Travel Laptop Backpack,https://www.amazon.in/Safari-45L-21-OB-BLK/dp/B07BZ5VC4H/ref=sr_1_129?keywords=bags&qid=1679381408&sr=8-129,4.5,"6,675","2,307"
171,"Chic Buddy Waterproof Wet Bag, Washable, Reusable for Travel, Beach, Pool, Stroller, Diapers, Dirty Gym Clothes, Wet Swimsuits, Toiletries",https://www.amazon.in/Chic-Buddy-Waterproof-Swimsuits-Toiletries/dp/B09KSBHC18/ref=sr_1_130?keywords=bags&qid=1679381408&sr=8-130,4.4,281,299
172,Amazon Brand - Solimo Sling Bag (Maroon),https://www.amazon.in/Amazon-Brand-Solimo-Sling-Maroon/dp/B07S63LC4P/ref=sr_1_131?keywords=bags&qid=1679381408&sr=8-131,3.9,239,219
173,"Medela Breastmilk Storage Bags,White, 25 Pieces",https://www.amazon.in/Medela-Breastmilk-Storage-Bags-Pieces/dp/B075R5R1LR/ref=sr_1_132?keywords=bags&qid=1679381408&sr=8-132,4.7,"2,938",840
174,"EUME Propine Laptop Backpack | Built-in Massager, Water Resistant & Anti-Theft | Fits Up-to 15.6"" MacBook (Melange, 22L)",https://www.amazon.in/sspa/click?ie=UTF8&spc=MTozNTEyNjI0MjkyOTA2MjQyOjE2NzkzODE0MDg6c3BfYnRmOjIwMTIxOTcyMjYwNDk4OjowOjo&url=%2FEUME-Propine-Massager-Backpack-Charging%2Fdp%2FB07XG935R9%2Fref%3Dsr_1_133_sspa%3Fkeywords%3Dbags%26qid%3D1679381408%26sr%3D8-133-spons%26sp_csd%3Dd2lkZ2V0TmFtZT1zcF9idGY%26psc%3D1%26smid%3DAPBFC7AMQ4Q38,4.1,45,"3,499"
175,"uppercase Medium 23 Ltrs Tall Boy (14.6 inch) Laptop Backpack 2500EBP1 3x more water resistant sustainable bag with rain proof zippers for Men, Women, Boys and Girls, 750 Days warranty",https://www.amazon.in/sspa/click?ie=UTF8&spc=MTozNTEyNjI0MjkyOTA2MjQyOjE2NzkzODE0MDg6c3BfYnRmOjIwMDY1NTMzNjg0Njk4OjowOjo&url=%2FPOLICE-ltrs-cms-backpack-PTO020008_1_black%2Fdp%2FB0B81YTTWS%2Fref%3Dsr_1_134_sspa%3Fkeywords%3Dbags%26qid%3D1679381408%26sr%3D8-134-spons%26sp_csd%3Dd2lkZ2V0TmFtZT1zcF9idGY%26psc%3D1,4.1,186,"1,700"
176,LOOKMUSTER Casual Waterproof Laptop Backpack/Office Bag/School Bag/College Bag/Business Bag/Travel Backpack,https://www.amazon.in/sspa/click?ie=UTF8&spc=MTo2OTc2ODI3NjE3MTQ3NjUwOjE2NzkzODE0MDk6c3BfYXRmX25leHQ6MjAxMjE0ODk2Mzg0OTg6OjA6Og&url=%2FLOOKMUSTER-Waterproof-Backpack-College-Business%2Fdp%2FB0BS6YGKMC%2Fref%3Dsr_1_129_sspa%3Fkeywords%3Dbags%26qid%3D1679381409%26sr%3D8-129-spons%26sp_csd%3Dd2lkZ2V0TmFtZT1zcF9hdGZfbmV4dA%26psc%3D1,5.0,2,528
177,"uppercase Medium 17 Ltrs Vegan Leather (upto 14 inch) Laptop Backpack 2300EBP1 3x more water resistant sustainable bags with rain proof zippers for Men, Women, Boys and Girls, 750 Days warranty",https://www.amazon.in/sspa/click?ie=UTF8&spc=MTo2OTc2ODI3NjE3MTQ3NjUwOjE2NzkzODE0MDk6c3BfYXRmX25leHQ6MjAxMjQzMTEwMjQ4OTg6OjA6Og&url=%2Fuppercase-Backpack-2300EBP1-resistant-sustainable%2Fdp%2FB0BWNCV31F%2Fref%3Dsr_1_130_sspa%3Fkeywords%3Dbags%26qid%3D1679381409%26sr%3D8-130-spons%26sp_csd%3Dd2lkZ2V0TmFtZT1zcF9hdGZfbmV4dA%26psc%3D1,0,0,"1,600"
178,Half Moon 34 L Water Resistant 15.6 inch Laptop Bag/Backpack for Men Women Boys Girls/Office School College with Padded Laptop Compartment (Grey),https://www.amazon.in/Half-Moon-Resistant-Backpack-Compartment/dp/B09GG53CSL/ref=sr_1_131?keywords=bags&qid=1679381409&sr=8-131,3.9,"1,216",749
179,Asus ROG BP1501 39.62 cm (15.6-inch) Gaming Laptop Backpack (Black),https://www.amazon.in/BP1501-15-6-inch-Gaming-Laptop-Backpack/dp/B081RLHHCY/ref=sr_1_132?keywords=bags&qid=1679381409&sr=8-132,4.3,875,"1,499"
180,NIVIA String Bag/Drawstring Bag/Sports Bag Boys/Polyester String Bag/Kit Bags/Drawstring Sports Bag/Dori Backpack/Gym Bag/String Bag Men Waterproof/Drawstring Backpack (Sky Blue),https://www.amazon.in/Nivia-5177SB-Polyester-String-Blue/dp/B071XMLFTL/ref=sr_1_133?keywords=bags&qid=1679381409&sr=8-133,4.1,456,193
181,"AirCase Office Sling Messenger Bag fits upto 15.6"" Laptop/Macbook, Detachable Shoulder Strap, Waterproof, Shockproof, Spacious Pockets for Office/Travel, Black- With Warranty",https://www.amazon.in/AirCase-C30-Messenger-Compartments-Multi-Pockets/dp/B07V47HHRG/ref=sr_1_134?keywords=bags&qid=1679381409&sr=8-134,3.8,"1,164","1,451"
182,Mi Business Casual 21L Water Resistant Laptop Backpack (Blue),https://www.amazon.in/Business-Casual-Resistant-Laptop-Backpack/dp/B0862V2GKH/ref=sr_1_135?keywords=bags&qid=1679381409&sr=8-135,4.4,"6,164",999
183,Cosmus Vogue Casual Laptop Backpack with USB Charger Port 46cm 26 Litre Dark Grey College Bag,https://www.amazon.in/Cosmus-Casual-Backpack-Charger-College/dp/B08D7DTWLF/ref=sr_1_136?keywords=bags&qid=1679381409&sr=8-136,4.2,"1,364","1,181"
184,"AirCase Sleeve Messenger Bag with Handle & Detachable Shoulder Strap |for Upto 14"" Laptop/ MacBook | 3-in-1 use | 3 Zippered Spacious Pockets | Durable Nylon Padded Fabric, for Men & Women (Black)",https://www.amazon.in/AirCase-C17-Laptop-Sleeve-Handle/dp/B07FJV79CX/ref=sr_1_137?keywords=bags&qid=1679381409&sr=8-137,4.1,"1,215",778
185,"Safari Seek 32 Ltrs Overnighter Travel Laptop Backpack (Blue), Water Resistant Spacious Bag for Travelling and Camping, All-Purpose Bag for Business & Leisure",https://www.amazon.in/Safari-Overnighter-Resistant-Travelling-All-Purpose/dp/B097JM98M1/ref=sr_1_138?keywords=bags&qid=1679381409&sr=8-138,4.3,73,"1,670"
186,"uppercase Apex Professional Laptop Backpack (15.6 Inch) 3x more water resistant sustainable bags with rain proof zippers for Men, Women, Boys and Girls, 750 Days warranty",https://www.amazon.in/sspa/click?ie=UTF8&spc=MTo2OTc2ODI3NjE3MTQ3NjUwOjE2NzkzODE0MDk6c3BfbXRmOjIwMTA1NDUxODUxNTk4OjowOjo&url=%2Fuppercase-Professional-Backpack-resistant-sustainable%2Fdp%2FB0BR1D4SL1%2Fref%3Dsr_1_139_sspa%3Fkeywords%3Dbags%26qid%3D1679381409%26sr%3D8-139-spons%26sp_csd%3Dd2lkZ2V0TmFtZT1zcF9tdGY%26psc%3D1,4.9,17,"1,800"
187,"MOKOBARA Backpack 15.5"" Inch Laptop Backpack For Women (16 litres ) Improved (2022 - Model)",https://www.amazon.in/sspa/click?ie=UTF8&spc=MTo2OTc2ODI3NjE3MTQ3NjUwOjE2NzkzODE0MDk6c3BfbXRmOjIwMTE3Nzk1ODc2OTk4OjowOjo&url=%2FMOKOBARA-TSBPK12CND22001-Backpack-Modern-Love%2Fdp%2FB08T1769X9%2Fref%3Dsr_1_140_sspa%3Fkeywords%3Dbags%26qid%3D1679381409%26sr%3D8-140-spons%26sp_csd%3Dd2lkZ2V0TmFtZT1zcF9tdGY%26psc%3D1%26smid%3DA2ZJIE4OXD710M,4.3,152,"4,499"
188,Lenovo Casual Laptop Backpack B210 39.62 cm (15.6) -inch Water Repellent Grey,https://www.amazon.in/Lenovo-Laptop-Backpack-15-6-Inch-GX40Q17227/dp/B075Y6SRMG/ref=sr_1_141?keywords=bags&qid=1679381409&sr=8-141,4.2,"54,725",785
189,COSMUS Darwin Navy Blue Laptop Backpack for (15.6 inch),https://www.amazon.in/COSMUS-Polyester-Navy-Laptop-Backpack/dp/B01FVQLLU0/ref=sr_1_142?keywords=bags&qid=1679381409&sr=8-142,4.3,"9,899","1,231"
190,ASTRID Women's Round Sling Bag with Pompoms (Brown),https://www.amazon.in/ASTRID-Womens-Round-Sling-Pompoms/dp/B08VS8JBNK/ref=sr_1_143?keywords=bags&qid=1679381409&sr=8-143,4.4,346,474
191,Lunar's Bingo - 48 L Laptop Office/School/Travel/Business Backpack Water Resistant - Fits Up to 15.6 Inch Laptop Notebook with 1 Year Warranty,https://www.amazon.in/Lunars-Bingo-Laptop-Resistant-48L/dp/B08YZ5XY31/ref=sr_1_144?keywords=bags&qid=1679381409&sr=8-144,3.9,"9,046",899
192,POLICE Backpack for Men Casual Laptop Bag Office/Travel/College 30 Ltr Hedge Polyester - Black,https://www.amazon.in/Police-Polyester-laptop-casual-backpack/dp/B09CQ5T3LN/ref=sr_1_145?keywords=bags&qid=1679381409&sr=8-145,4.1,"5,292","1,399"
193,Protecta The Professional Laptop Bag Briefcase for Laptops with Screen Size Up to 15.6 Inch (Black & Indian Geometric Print),https://www.amazon.in/Protecta-Professional-15-6-inch-Briefcase-Geometric/dp/B07GNCRCP4/ref=sr_1_146?keywords=bags&qid=1679381409&sr=8-146,4.4,"1,411",674
194,"Arctic Hunter Laptop Bag Expandable Backpack for 16 inch Lapotp 40L Travel Backpack Water-resistant Business School Backpack with USB Port for Men and Women,Black",https://www.amazon.in/Expandable-Backpack-Water-resistant-Business-Charging/dp/B0B6FNB898/ref=sr_1_147?keywords=bags&qid=1679381409&sr=8-147,4.2,20,"3,324"
195,Amazon Brand - Solimo Sling Bag (Maroon),https://www.amazon.in/Amazon-Brand-Solimo-Sling-Maroon/dp/B07S63LC4P/ref=sr_1_148?keywords=bags&qid=1679381409&sr=8-148,3.9,239,219
196,"EUME Propine Laptop Backpack | Built-in Massager, Water Resistant & Anti-Theft | Fits Up-to 15.6"" MacBook (Melange, 22L)",https://www.amazon.in/sspa/click?ie=UTF8&spc=MTo2OTc2ODI3NjE3MTQ3NjUwOjE2NzkzODE0MDk6c3BfYnRmOjIwMTIxOTcyMjYwNDk4OjowOjo&url=%2FEUME-Propine-Massager-Backpack-Charging%2Fdp%2FB07XG935R9%2Fref%3Dsr_1_149_sspa%3Fkeywords%3Dbags%26qid%3D1679381409%26sr%3D8-149-spons%26sp_csd%3Dd2lkZ2V0TmFtZT1zcF9idGY%26psc%3D1%26smid%3DAPBFC7AMQ4Q38,4.1,45,"3,499"
197,"uppercase Medium 23 Ltrs Tall Boy (14.6 inch) Laptop Backpack 2500EBP1 3x more water resistant sustainable bag with rain proof zippers for Men, Women, Boys and Girls, 750 Days warranty",https://www.amazon.in/sspa/click?ie=UTF8&spc=MTo2OTc2ODI3NjE3MTQ3NjUwOjE2NzkzODE0MDk6c3BfYnRmOjIwMDY1NTMzNjg0Njk4OjowOjo&url=%2FPOLICE-ltrs-cms-backpack-PTO020008_1_black%2Fdp%2FB0B81YTTWS%2Fref%3Dsr_1_150_sspa%3Fkeywords%3Dbags%26qid%3D1679381409%26sr%3D8-150-spons%26sp_csd%3Dd2lkZ2V0TmFtZT1zcF9idGY%26psc%3D1,4.1,186,"1,700"
198,LOOKMUSTER Casual Waterproof Laptop Backpack/Office Bag/School Bag/College Bag/Business Bag/Travel Backpack,https://www.amazon.in/sspa/click?ie=UTF8&spc=MTozODM5ODAxNTcxNTY2MDIzOjE2NzkzODE0MTE6c3BfYXRmX25leHQ6MjAxMjE0ODk2Mzg0OTg6OjA6Og&url=%2FLOOKMUSTER-Waterproof-Backpack-College-Business%2Fdp%2FB0BS6YGKMC%2Fref%3Dsr_1_145_sspa%3Fkeywords%3Dbags%26qid%3D1679381411%26sr%3D8-145-spons%26sp_csd%3Dd2lkZ2V0TmFtZT1zcF9hdGZfbmV4dA%26psc%3D1,5.0,2,528
199,"uppercase Medium 17 Ltrs Vegan Leather (upto 14 inch) Laptop Backpack 2300EBP1 3x more water resistant sustainable bags with rain proof zippers for Men, Women, Boys and Girls, 750 Days warranty",https://www.amazon.in/sspa/click?ie=UTF8&spc=MTozODM5ODAxNTcxNTY2MDIzOjE2NzkzODE0MTE6c3BfYXRmX25leHQ6MjAxMjQzMTEwMjQ4OTg6OjA6Og&url=%2Fuppercase-Backpack-2300EBP1-resistant-sustainable%2Fdp%2FB0BWNCV31F%2Fref%3Dsr_1_146_sspa%3Fkeywords%3Dbags%26qid%3D1679381411%26sr%3D8-146-spons%26sp_csd%3Dd2lkZ2V0TmFtZT1zcF9hdGZfbmV4dA%26psc%3D1,M.R.P: ,0,"1,600"
200,"uppercase Medium 23 Ltrs Tall Boy (14.6 inch) Laptop Backpack 2500EBP1 3x more water resistant sustainable bag with rain proof zippers for Men, Women, Boys and Girls, 750 Days warranty",https://www.amazon.in/uppercase-Backpack-2500EBP1-resistant-sustainable/dp/B0BTDB674X/ref=sr_1_147?keywords=bags&qid=1679381411&sr=8-147,4.1,186,"1,700"
201,NETTIE Cotton Carry Bag with Strap and Drawstring for Yoga Mat- Big Size,https://www.amazon.in/NETTIE-Cotton-Carry-Strap-Drawstring/dp/B08LBT1R9J/ref=sr_1_148?keywords=bags&qid=1679381411&sr=8-148,4.1,"1,004",198
202,Lavie Women's Broxa Flap Over Sling Bag | Ladies Purse Handbag,https://www.amazon.in/Lavie-Broxa-Womens-Sling-Plum/dp/B08JDG1NKX/ref=sr_1_149?keywords=bags&qid=1679381411&sr=8-149,4.2,"5,676",999
203,Baggit Women's Laptop Bag - Large (Blue),https://www.amazon.in/Baggit-Womens-Laptop-Bag-Large/dp/B0BNTPMT2G/ref=sr_1_150?keywords=bags&qid=1679381411&sr=8-150,M.R.P: ,0,"1,259"
204,Wesley Milestone 15.6 inch 25 L Casual Waterproof Laptop Backpack/Office Bag/School Bag/College Bag/Business Bag/Unisex Travel Backpack (Black),https://www.amazon.in/Wesley-Milestone-Waterproof-Backpack-Business/dp/B07NJRPJ6Q/ref=sr_1_151?keywords=bags&qid=1679381411&sr=8-151,4.3,"12,341",498
205,Skybags New Neon 30 L Backpack (Purple),https://www.amazon.in/Skybags-New-Neon-Backpack-Purple/dp/B07SRHCF9R/ref=sr_1_152?keywords=bags&qid=1679381411&sr=8-152,4.3,100,999
206,SBCOLLECTION Premium School College Office Laptop Daily Use Backpack for All Day Traveler,https://www.amazon.in/SBCOLLECTION-Premium-Backpack-Water-Resistance-Business/dp/B0BXL5B1J4/ref=sr_1_153?keywords=bags&qid=1679381411&sr=8-153,4.5,3,229
207,Aristrocrat Unisex Laptop Bag Grey,https://www.amazon.in/Aristocrat-Zeal-Unisex-Grey-Laptop/dp/B0B5YHC1W5/ref=sr_1_154?keywords=bags&qid=1679381411&sr=8-154,4.4,18,699
208,"uppercase Apex Professional Laptop Backpack (15.6 Inch) 3x more water resistant sustainable bags with rain proof zippers for Men, Women, Boys and Girls, 750 Days warranty",https://www.amazon.in/sspa/click?ie=UTF8&spc=MTozODM5ODAxNTcxNTY2MDIzOjE2NzkzODE0MTE6c3BfbXRmOjIwMTA1NDUxODUxNTk4OjowOjo&url=%2Fuppercase-Professional-Backpack-resistant-sustainable%2Fdp%2FB0BR1D4SL1%2Fref%3Dsr_1_155_sspa%3Fkeywords%3Dbags%26qid%3D1679381411%26sr%3D8-155-spons%26sp_csd%3Dd2lkZ2V0TmFtZT1zcF9tdGY%26psc%3D1,4.9,17,"1,800"
209,"MOKOBARA Backpack 15.5"" Inch Laptop Backpack For Women (16 litres ) Improved (2022 - Model)",https://www.amazon.in/sspa/click?ie=UTF8&spc=MTozODM5ODAxNTcxNTY2MDIzOjE2NzkzODE0MTE6c3BfbXRmOjIwMTE3Nzk1ODc2OTk4OjowOjo&url=%2FMOKOBARA-TSBPK12CND22001-Backpack-Modern-Love%2Fdp%2FB08T1769X9%2Fref%3Dsr_1_156_sspa%3Fkeywords%3Dbags%26qid%3D1679381411%26sr%3D8-156-spons%26sp_csd%3Dd2lkZ2V0TmFtZT1zcF9tdGY%26psc%3D1%26smid%3DA2ZJIE4OXD710M,4.3,152,"4,499"
210,"POLESTAR Leader 34 L Bag for College, School, Office, Casual Multipurpose Backpack with 15.6"" Laptop Compartment, Water Resistant, Unisex Design, Stylish & Durable, 1 Year Warranty",https://www.amazon.in/POLESTAR-backpack-Backpack-College-Students/dp/B08X2JSJ6N/ref=sr_1_157?keywords=bags&qid=1679381411&sr=8-157,4.1,"3,429",599
211,Gear Vintage2 Anti Theft Faux Leather 18 cms Tan Laptop Backpack,https://www.amazon.in/Gear-Vintage2-Leather-Backpack-LBPVG2LTH1901/dp/B07G4F3758/ref=sr_1_158?keywords=bags&qid=1679381411&sr=8-158,4.3,"1,460","1,075"
212,POLICE Polyester 35 Ltr Laptop Big Low Spec Laptop Backpack - Black/Navy,https://www.amazon.in/Police-Polyester-Laptop-Spec-Backpack/dp/B07ZB8NWTZ/ref=sr_1_159?keywords=bags&qid=1679381411&sr=8-159,3.3,188,"1,569"
213,ADISA Laptop Backpack 31 Ltrs,https://www.amazon.in/ADISA-BP004-Weight-Casual-Backpack/dp/B07G3F1G7T/ref=sr_1_160?keywords=bags&qid=1679381411&sr=8-160,4.0,"9,083",499
214,"uppercase Medium 17 Ltrs Vegan Leather (upto 14 inch) Laptop Backpack 2300EBP1 3x more water resistant sustainable bags with rain proof zippers for Men, Women, Boys and Girls, 750 Days warranty",https://www.amazon.in/uppercase-Backpack-2300EBP1-resistant-sustainable/dp/B0BWNCV31F/ref=sr_1_161?keywords=bags&qid=1679381411&sr=8-161,M.R.P: ,0,"1,600"
215,"Genie Clara Backpack for Women - 3 compartments, Laptop Bags for Girls, Stylish and Trendy College Backpacks for Girls, Water Resistant and Lightweight Bags for Office and Travelling Purpose.",https://www.amazon.in/Genie-Clara-Backpack-Women-compartments/dp/B097JJGR1N/ref=sr_1_162?keywords=bags&qid=1679381411&sr=8-162,4.2,56,"1,025"
216,TSPARK Red Lemon bg1905 15.6 inch 35 LTR Capacity Laptop Bag for Men Travelling Hiking Backpack for Men and Women,https://www.amazon.in/bg1905-Capacity-Laptop-Travelling-Backpack/dp/B082MKHDJ1/ref=sr_1_163?keywords=bags&qid=1679381411&sr=8-163,4.3,64,"2,849"
217,VEZELA Handbags for Women-Combo Pack of 4-Shoulder Bag Crossbody Bag Sling Bag Card Holder-Set of 4 Purse for Women-Golden,https://www.amazon.in/VEZELA-Womens-Shoulder-Crossbody-Handbag/dp/B01MS1GRDW/ref=sr_1_164?keywords=bags&qid=1679381411&sr=8-164,4.0,577,"1,948"
218,"EUME Propine Laptop Backpack | Built-in Massager, Water Resistant & Anti-Theft | Fits Up-to 15.6"" MacBook (Melange, 22L)",https://www.amazon.in/sspa/click?ie=UTF8&spc=MTozODM5ODAxNTcxNTY2MDIzOjE2NzkzODE0MTE6c3BfYnRmOjIwMTIxOTcyMjYwNDk4OjowOjo&url=%2FEUME-Propine-Massager-Backpack-Charging%2Fdp%2FB07XG935R9%2Fref%3Dsr_1_165_sspa%3Fkeywords%3Dbags%26qid%3D1679381411%26sr%3D8-165-spons%26sp_csd%3Dd2lkZ2V0TmFtZT1zcF9idGY%26psc%3D1%26smid%3DAPBFC7AMQ4Q38,4.1,45,"3,499"
219,"uppercase SealPro Professional Laptop Backpack (15.6 Inch) 3x more water resistant sustainable bags with rain proof zippers & Anti-theft for Men, Women, Boys and Girls, 750 Days warranty",https://www.amazon.in/sspa/click?ie=UTF8&spc=MTozODM5ODAxNTcxNTY2MDIzOjE2NzkzODE0MTE6c3BfYnRmOjIwMTA1NzE1ODIxNTk4OjowOjo&url=%2Fuppercase-Professional-resistant-sustainable-Anti-theft%2Fdp%2FB0BR1C59R8%2Fref%3Dsr_1_166_sspa%3Fkeywords%3Dbags%26qid%3D1679381411%26sr%3D8-166-spons%26sp_csd%3Dd2lkZ2V0TmFtZT1zcF9idGY%26psc%3D1,4.9,23,"1,900"
220,LOOKMUSTER Casual Waterproof Laptop Backpack/Office Bag/School Bag/College Bag/Business Bag/Travel Backpack,https://www.amazon.in/sspa/click?ie=UTF8&spc=MTo2NzYxOTMwMjM3NzE2NjY6MTY3OTM4MTQxMzpzcF9hdGZfbmV4dDoyMDEyMTQ4OTYzODQ5ODo6MDo6&url=%2FLOOKMUSTER-Waterproof-Backpack-College-Business%2Fdp%2FB0BS6YGKMC%2Fref%3Dsr_1_161_sspa%3Fkeywords%3Dbags%26qid%3D1679381413%26sr%3D8-161-spons%26sp_csd%3Dd2lkZ2V0TmFtZT1zcF9hdGZfbmV4dA%26psc%3D1,5.0,2,528
221,"uppercase Medium 17 Ltrs Vegan Leather (upto 14 inch) Laptop Backpack 2300EBP1 3x more water resistant sustainable bags with rain proof zippers for Men, Women, Boys and Girls, 750 Days warranty",https://www.amazon.in/sspa/click?ie=UTF8&spc=MTo2NzYxOTMwMjM3NzE2NjY6MTY3OTM4MTQxMzpzcF9hdGZfbmV4dDoyMDEyNDMxMTAyNDg5ODo6MDo6&url=%2Fuppercase-Backpack-2300EBP1-resistant-sustainable%2Fdp%2FB0BWNCV31F%2Fref%3Dsr_1_162_sspa%3Fkeywords%3Dbags%26qid%3D1679381413%26sr%3D8-162-spons%26sp_csd%3Dd2lkZ2V0TmFtZT1zcF9hdGZfbmV4dA%26psc%3D1,M.R.P: ,0,"1,600"
222,VEZELA Handbags for Women-Combo Pack of 4-Shoulder Bag Crossbody Bag Sling Bag Card Holder-Set of 4 Purse for Women-Golden,https://www.amazon.in/VEZELA-Womens-Shoulder-Crossbody-Handbag/dp/B01MS1GRDW/ref=sr_1_163?keywords=bags&qid=1679381413&sr=8-163,4.0,577,"1,948"
223,Victorinox Nylon Black Laptop Bag (31322601),https://www.amazon.in/Victorinox-Nylon-Black-Laptop-31322601/dp/B004UCORV2/ref=sr_1_164?keywords=bags&qid=1679381413&sr=8-164,4.5,11,"25,320"
224,Li-Ning Panther Double Zipper Polyester Badminton Kit Bag,https://www.amazon.in/Li-Ning-Panther-Double-Polyester-Badminton/dp/B09VDQDXWN/ref=sr_1_165?keywords=bags&qid=1679381413&sr=8-165,4.3,314,999
225,Wesley office Laptop Bag briefcase notebook professional business 15.6 Inch Briefcase messenger sling Water resistant Laptop Bag Tablet Business Carrying Handbag for Women and Men (Charcoal Black),https://www.amazon.in/Wesley-briefcase-professional-Briefcase-messenger/dp/B0BJVDN7VT/ref=sr_1_166?keywords=bags&qid=1679381413&sr=8-166,4.0,"1,173",498
226,HEROZ Hacker 50 litres Nylon Travel Laptop Backpack Water Resistant Slim Durable Computer Book Bag Tracking Fits Up to 17.3-inch Laptop (058- ALL) (Navy Blue),https://www.amazon.in/HEROZ-Backpack-Resistant-Computer-17-3-inch/dp/B083N3DCTM/ref=sr_1_167?keywords=bags&qid=1679381413&sr=8-167,4.1,"3,717","1,439"
227,Gear Classic 20L Faux Leather Water Resistant Anti Theft Laptop Bag/Backpack for Men/Women-Black,https://www.amazon.in/Gear-Classic-Leather-Backpack-LBPCLSLTH0101/dp/B07G4D13LB/ref=sr_1_168?keywords=bags&qid=1679381413&sr=8-168,4.4,"2,610","1,030"
228,"Renva Large Capacity Cosmetic Travel Bag, Women's Makeup Travel Bag Portable Leather Cosmetic Bag, Makeup Storage Bags with Handle and Divider,Makeup Organizer Bags (1 pcs, Black)",https://www.amazon.in/Capacity-Cosmetic-Portable-Leather-Organizer/dp/B0BTDKL3KX/ref=sr_1_169?keywords=bags&qid=1679381413&sr=8-169,4.0,16,629
229,POLICE Polyester 35 Ltr Laptop Big Low Spec Laptop Backpack - Black/Navy,https://www.amazon.in/Police-Polyester-Laptop-Spec-Backpack/dp/B07ZB8NWTZ/ref=sr_1_170?keywords=bags&qid=1679381413&sr=8-170,3.3,188,"1,569"
230,"MOKOBARA Backpack 15.5"" Inch Laptop Backpack For Women (16 litres ) Improved (2022 - Model)",https://www.amazon.in/sspa/click?ie=UTF8&spc=MTo2NzYxOTMwMjM3NzE2NjY6MTY3OTM4MTQxMzpzcF9tdGY6MjAxMTc3OTU4NzY5OTg6OjA6Og&url=%2FMOKOBARA-TSBPK12CND22001-Backpack-Modern-Love%2Fdp%2FB08T1769X9%2Fref%3Dsr_1_171_sspa%3Fkeywords%3Dbags%26qid%3D1679381413%26sr%3D8-171-spons%26sp_csd%3Dd2lkZ2V0TmFtZT1zcF9tdGY%26psc%3D1%26smid%3DA2ZJIE4OXD710M,4.3,152,"4,499"
231,Red Lemon Unisex-adult Bange Series Rhombus Shell Design Waterproof Sling Bag with USB Charging,https://www.amazon.in/sspa/click?ie=UTF8&spc=MTo2NzYxOTMwMjM3NzE2NjY6MTY3OTM4MTQxMzpzcF9tdGY6MjAxMjgyNTg3OTUyOTg6OjA6Og&url=%2FRed-Lemon-Unisex-adult-Waterproof-Charging%2Fdp%2FB09VGNTDRZ%2Fref%3Dsr_1_172_sspa%3Fkeywords%3Dbags%26qid%3D1679381413%26sr%3D8-172-spons%26sp_csd%3Dd2lkZ2V0TmFtZT1zcF9tdGY%26psc%3D1,4.1,56,"1,899"
232,Gear Vintage2 Anti Theft Faux Leather 18 cms Tan Laptop Backpack,https://www.amazon.in/Gear-Vintage2-Leather-Backpack-LBPVG2LTH1901/dp/B07G4F3758/ref=sr_1_173?keywords=bags&qid=1679381413&sr=8-173,4.3,"1,460","1,075"
233,"uppercase Medium 17 Ltrs Vegan Leather (14.6 inch) Laptop Backpack 2300EBP1 3x more water resistant sustainable bags with rain proof zippers for Men, Women, Boys and Girls, 750 Days warranty (Green)",https://www.amazon.in/uppercase-Backpack-2300EBP1-repellent-sustainable/dp/B0B69M182Q/ref=sr_1_174?keywords=bags&qid=1679381413&sr=8-174,M.R.P: ,0,"1,600"
234,"Amazon Basics - Laptop Backpack/College Bag/Travel Bag for 15.6-inch Laptop, Water-Resistant, Casual",https://www.amazon.in/Amazon-Basics-Professional-Backpack-15-inch-Laptop/dp/B09W4WB3K5/ref=sr_1_175?keywords=bags&qid=1679381413&sr=8-175,3.5,5,"1,349"
235,Wooum 48 L Casual Water Resistance Laptop Bag/Backpack for Men Women Boys Girls/Office School College Teens & Students with 15.6 Inch Laptop Compartment 50x37x26Cm,https://www.amazon.in/Resistance-Backpack-Students-Compartment-50x37x26Cm/dp/B09X5Y2CB2/ref=sr_1_176?keywords=bags&qid=1679381413&sr=8-176,3.6,57,569.
236,Tabelito® Casual 15.6 Inch (39.6 cm) Water Repellent Laptop Backpack Office College School Business Travel Bag Suitable for Men Women Boys & Girls Capacity 25 Litre (Grey),https://www.amazon.in/Tabelito-Laptop-Backpack-15-6-inch-Repellent/dp/B08Y3L4PHK/ref=sr_1_177?keywords=bags&qid=1679381413&sr=8-177,4.2,"1,597",549
237,"AirCase Laptop bag Anti Theft Backpack for Office College & Travel fits upto 15.6"" Laptop/Macbook, Waterproof, Durable, Multi-Pockets, 180° open (Black)- 1 Yr warranty",https://www.amazon.in/Aircase-Backpack-Rucksack-Anti-Theft-Charging/dp/B07SX3X79F/ref=sr_1_178?keywords=bags&qid=1679381413&sr=8-178,4.3,160,"1,199"
238,COSMUS Vogue Casual Laptop Backpack with USB Charger Port 46cm 26 Litre Maroon College Bag,https://www.amazon.in/Cosmus-Casual-Backpack-Charger-College/dp/B09HX54TGF/ref=sr_1_179?keywords=bags&qid=1679381413&sr=8-179,4.2,"1,364","1,181"
239,HEROZ Hacker 50 litres Nylon Travel Laptop Backpack Water Resistant Slim Durable Computer Book Bag Tracking Fits Up to 17.3-inch Laptop (058- All) (Grey & Red),https://www.amazon.in/HEROZ-Backpack-Resistant-Computer-17-3-inch/dp/B083N53TWB/ref=sr_1_180?keywords=bags&qid=1679381413&sr=8-180,4.1,"3,717","1,439"
240,"uppercase Apex Professional Laptop Backpack (15.6 Inch) 3x more water resistant sustainable bags with rain proof zippers for Men, Women, Boys and Girls, 750 Days warranty",https://www.amazon.in/sspa/click?ie=UTF8&spc=MTo2NzYxOTMwMjM3NzE2NjY6MTY3OTM4MTQxMzpzcF9idGY6MjAxMDU0NTE4NTE1OTg6OjA6Og&url=%2Fuppercase-Professional-Backpack-resistant-sustainable%2Fdp%2FB0BR1D4SL1%2Fref%3Dsr_1_181_sspa%3Fkeywords%3Dbags%26qid%3D1679381413%26sr%3D8-181-spons%26sp_csd%3Dd2lkZ2V0TmFtZT1zcF9idGY%26psc%3D1,4.9,17,"1,800"
