,Product Name,URL,Rating,Reviews,Price
0,Red Lemon Swisslook Polyester Bange Series 45L 15.6-inch Laptop Bags Backpack for Men and Women Waterproof USB Anti Theft Travel Backpack,https://www.amazon.in/sspa/click?ie=UTF8&spc=MTo4MDExNjA3MjQwMzkyMTc3OjE2NzkzODEzOTM6c3BfYXRmOjIwMTI4MjU4Nzk1MTk4OjowOjo&url=%2FSwisslook-Polyester-15-6-inch-Backpack-Waterproof%2Fdp%2FB07XYTZP4Z%2Fref%3Dsr_1_1_sspa%3Fkeywords%3Dbags%26qid%3D1679381393%26sr%3D8-1-spons%26sp_csd%3Dd2lkZ2V0TmFtZT1zcF9hdGY%26psc%3D1,4.3,"1,377","2,849"
1,Red Lemon Bange Hard Ironlook Briefcase Laptop Bag Anti-Theft Hard Shell Unisex Laptop Backpack with USB Charging Backpack for Men and Women,https://www.amazon.in/sspa/click?ie=UTF8&spc=MTo4MDExNjA3MjQwMzkyMTc3OjE2NzkzODEzOTM6c3BfYXRmOjIwMTI4MjU4Nzk2Njk4OjowOjo&url=%2FRed-Lemon-Ironlook-Briefcase-Anti-Theft%2Fdp%2FB09ZYMT7V1%2Fref%3Dsr_1_2_sspa%3Fkeywords%3Dbags%26qid%3D1679381393%26sr%3D8-2-spons%26sp_csd%3Dd2lkZ2V0TmFtZT1zcF9hdGY%26psc%3D1,4.3,61,"4,599"
2,American Tourister 32 Ltrs Black Casual Backpack (AMT FIZZ SCH BAG 02 - BLACK),https://www.amazon.in/American-Tourister-AMT-SCH-02/dp/B07CJCGM1M/ref=sr_1_3?keywords=bags&qid=1679381393&sr=8-3,4.1,"52,288","1,199"
3,Wesley Milestone 2.0 Casual Waterproof Laptop Backpack/Office Bag/School Bag/College Bag/Business Bag/Travel Backpack (Dimensions:13x18 inches) (Compatible with 39.62cm(15.6inch laptop) 30 L (Blue & black),https://www.amazon.in/Wesley-Milestone-Waterproof-Backpack-Business/dp/B084JGJ8PF/ref=sr_1_4?keywords=bags&qid=1679381393&sr=8-4,4.3,"9,794",565
4,Lavie Sport Lino Large Size 63 cms Wheel Duffle Bag for Travel | Travel Bag with Trolley,https://www.amazon.in/Lavie-Sport-Duffle-Luggage-Trolley/dp/B097RJ22Q3/ref=sr_1_5?keywords=bags&qid=1679381393&sr=8-5,3.9,"6,297",949
5,ADISA 15.6 inch Laptop Backpack Office Bag College Travel Back Pack 32 Ltrs (z-Navy Blue),https://www.amazon.in/ADISA-Laptop-Backpack-Office-College/dp/B09TPX22NF/ref=sr_1_6?keywords=bags&qid=1679381393&sr=8-6,3.8,566,499
6,Skybags Brat Black 46 Cms Casual Backpack,https://www.amazon.in/Skybags-Brat-Black-Casual-Backpack/dp/B08Z1HHHTD/ref=sr_1_7?keywords=bags&qid=1679381393&sr=8-7,4.1,"3,770",659
7,Half Moon 35 L Waterproof Laptop College School Office Bag Backpack for Men Women Boys Girls with 15.6 inch Padded Laptop Compartment & Rain Cover (Navy_Blue),https://www.amazon.in/Half-Moon-Waterproof-Backpack-Students/dp/B085MHDJ93/ref=sr_1_8?keywords=bags&qid=1679381393&sr=8-8,3.9,"15,248",689
8,Gear CarryOn 16L Foldable Water Resistant School Bag//Backpack/College Bag for Men/Women - Blue Black,https://www.amazon.in/GEAR-Black-Blue-Backpack-years/dp/B019HA8AYG/ref=sr_1_9?keywords=bags&qid=1679381393&sr=8-9,3.7,"6,056",214
9,Half Moon Strike 35L Unisex Spacious School/Laptop/College/Office Travel Backpack Bag for Men Women Boys & Girls with 15.6 inch Padded Laptop Compartment & Multiple Pockets,https://www.amazon.in/Half-Moon-Spacious-Backpack-Compartment/dp/B0BLVQ9NTD/ref=sr_1_10?keywords=bags&qid=1679381393&sr=8-10,3.7,115,699
10,Red Lemon Unisex-adult Bange Series Rhombus Shell Design Waterproof Sling Bag with USB Charging,https://www.amazon.in/sspa/click?ie=UTF8&spc=MTo4MDExNjA3MjQwMzkyMTc3OjE2NzkzODEzOTM6c3BfbXRmOjIwMTI4MjU4Nzk1Mjk4OjowOjo&url=%2FRed-Lemon-Unisex-adult-Waterproof-Charging%2Fdp%2FB09VGNTDRZ%2Fref%3Dsr_1_11_sspa%3Fkeywords%3Dbags%26qid%3D1679381393%26sr%3D8-11-spons%26sp_csd%3Dd2lkZ2V0TmFtZT1zcF9tdGY%26psc%3D1,4.1,56,"1,899"
11,FUR JADEN Vegan Leather 30L 15.6 Inch Laptop Backpack for Men Women for Office Professionals and College Students,https://www.amazon.in/sspa/click?ie=UTF8&spc=MTo4MDExNjA3MjQwMzkyMTc3OjE2NzkzODEzOTM6c3BfbXRmOjIwMTAwODU1MDk4NTk4OjowOjo&url=%2FFur-Jaden-resistant-Backpack-BM100_Brown%2Fdp%2FB07P5X6NSN%2Fref%3Dsr_1_12_sspa%3Fkeywords%3Dbags%26qid%3D1679381393%26sr%3D8-12-spons%26sp_csd%3Dd2lkZ2V0TmFtZT1zcF9tdGY%26psc%3D1,4.2,"2,237",889
12,"American Tourister VALEX BLUE LAPTOP BACKPACK 28 Ltrs,Volume, LAPTOP COMPARTMENT, BOTTLE POCKET, FRONT ORGANIZER",https://www.amazon.in/American-Tourister-BACKPACK-COMPARTMENT-ORGANIZER/dp/B0BTD4FK9G/ref=sr_1_13?keywords=bags&qid=1679381393&sr=8-13,4.1,8,"1,299"
13,SAFARI 15 Ltrs Sea Blue Casual/School/College Backpack (DAYPACKNEO15CBSEB),https://www.amazon.in/SAFARI-Ltrs-Casual-Backpack-DAYPACKNEO15CBSEB/dp/B07Q7CNPMV/ref=sr_1_14?keywords=bags&qid=1679381393&sr=8-14,4.0,"18,009",299
14,Half Moon Large 37L Laptop Bag Backpack for menं Women Boys and Girls Luggage Travel Bags with 17.3 inches Laptop Compartment & Rain Cover,https://www.amazon.in/Half-Moon-Backpack-Compartment-Reflective/dp/B0BJ32LQ6X/ref=sr_1_15?keywords=bags&qid=1679381393&sr=8-15,3.9,"2,340",849
15,"Mi Step Out 12 L Mini Backpack (Small Size, Black, Water Repellant)",https://www.amazon.in/Backpack-Small-Black-Water-Repellant/dp/B088XB5XY8/ref=sr_1_16?keywords=bags&qid=1679381393&sr=8-16,4.1,"8,155",398
16,Gear Classic 20L Faux Leather Water Resistant Anti Theft Laptop Bag/Backpack for Men/Women-Brown,https://www.amazon.in/Gear-Classic-Leather-Backpack-LBPCLSLTH0201/dp/B07G4F6XFH/ref=sr_1_17?keywords=bags&qid=1679381393&sr=8-17,4.4,"5,454","1,075"
17,"Safari Quill Laptop Backpack 26 Ltrs Water Resistant Fabric - Black, L (QUILL19CBBLK)",https://www.amazon.in/Safari-Laptop-Backpack-Resistant-Fabric/dp/B09B25Z8M2/ref=sr_1_18?keywords=bags&qid=1679381393&sr=8-18,3.9,715,799
18,ADISA Light Weight Laptop Backpack 32 Ltrs,https://www.amazon.in/ADISA-BP005-Weight-Casual-Backpack/dp/B07F3X45WZ/ref=sr_1_19?keywords=bags&qid=1679381393&sr=8-19,4.0,"5,646",499
19,ADISA 35L Large Laptop Backpack Office Bag College Travel Back Pack with rain Cover (Grey),https://www.amazon.in/ADISA-Laptop-Backpack-Office-College/dp/B0BPVLXD53/ref=sr_1_20?keywords=bags&qid=1679381393&sr=8-20,4.0,31,599
20,"uppercase Apex Professional Laptop Backpack (15.6 Inch) 3x more water resistant sustainable bags with rain proof zippers for Men, Women, Boys and Girls, 750 Days warranty",https://www.amazon.in/sspa/click?ie=UTF8&spc=MTo4MDExNjA3MjQwMzkyMTc3OjE2NzkzODEzOTM6c3BfYnRmOjIwMTA1NDUxODUxNTk4OjowOjo&url=%2Fuppercase-Professional-Backpack-resistant-sustainable%2Fdp%2FB0BR1D4SL1%2Fref%3Dsr_1_21_sspa%3Fkeywords%3Dbags%26qid%3D1679381393%26sr%3D8-21-spons%26sp_csd%3Dd2lkZ2V0TmFtZT1zcF9idGY%26psc%3D1,4.9,17,"1,800"
21,"uppercase Medium 17 Ltrs Vegan Leather (upto 14 inch) Laptop Backpack 2300EBP1 3x more water resistant sustainable bags with rain proof zippers for Men, Women, Boys and Girls, 750 Days warranty",https://www.amazon.in/sspa/click?ie=UTF8&spc=MTo4MDExNjA3MjQwMzkyMTc3OjE2NzkzODEzOTM6c3BfYnRmOjIwMTI0MzExMDI0ODk4OjowOjo&url=%2Fuppercase-Backpack-2300EBP1-resistant-sustainable%2Fdp%2FB0BWNCV31F%2Fref%3Dsr_1_22_sspa%3Fkeywords%3Dbags%26qid%3D1679381393%26sr%3D8-22-spons%26sp_csd%3Dd2lkZ2V0TmFtZT1zcF9idGY%26psc%3D1,New to Amazon,0,"1,600"
22,LOOKMUSTER Casual Waterproof Laptop Backpack/Office Bag/School Bag/College Bag/Business Bag/Travel Backpack,https://www.amazon.in/sspa/click?ie=UTF8&spc=MTozNDg2MzQwODEwNjczNzc0OjE2NzkzODEzOTU6c3BfYXRmX25leHQ6MjAxMjE0ODk2Mzg0OTg6OjA6Og&url=%2FLOOKMUSTER-Waterproof-Backpack-College-Business%2Fdp%2FB0BS6YGKMC%2Fref%3Dsr_1_17_sspa%3Fkeywords%3Dbags%26qid%3D1679381395%26sr%3D8-17-spons%26sp_csd%3Dd2lkZ2V0TmFtZT1zcF9hdGZfbmV4dA%26psc%3D1,5.0,2,528
23,"EUME Propine Laptop Backpack | Built-in Massager, Water Resistant & Anti-Theft | Fits Up-to 15.6"" MacBook (Melange, 22L)",https://www.amazon.in/sspa/click?ie=UTF8&spc=MTozNDg2MzQwODEwNjczNzc0OjE2NzkzODEzOTU6c3BfYXRmX25leHQ6MjAxMjE5NzIyNjA0OTg6OjA6Og&url=%2FEUME-Propine-Massager-Backpack-Charging%2Fdp%2FB07XG935R9%2Fref%3Dsr_1_18_sspa%3Fkeywords%3Dbags%26qid%3D1679381395%26sr%3D8-18-spons%26sp_csd%3Dd2lkZ2V0TmFtZT1zcF9hdGZfbmV4dA%26psc%3D1%26smid%3DAPBFC7AMQ4Q38,4.1,45,"3,499"
24,Half Moon Large 37L Laptop Bag Backpack for menं Women Boys and Girls Luggage Travel Bags with 17.3 inches Laptop Compartment & Rain Cover,https://www.amazon.in/Half-Moon-Backpack-Luggage-Compartment/dp/B09VCLZ3K4/ref=sr_1_19?keywords=bags&qid=1679381395&sr=8-19,3.9,"2,340",849
25,Gear Aspire 30L Water Restant Office Laptop Bag/Backpack for Men/Women/(Black),https://www.amazon.in/Gear-Black-Laptop-Backpack-LBPASPIRE0104/dp/B075MK4TXP/ref=sr_1_20?keywords=bags&qid=1679381395&sr=8-20,4.3,"5,161","1,131"
26,"Fur Jaden 55 LTR Rucksack Travel Backpack Bag for Trekking, Hiking with Shoe Compartment",https://www.amazon.in/Rucksack-Travel-Backpack-Trekking-Compartment/dp/B07YDGQQN5/ref=sr_1_21?keywords=bags&qid=1679381395&sr=8-21,4.2,"4,957",839
27,Wesley Milestone 15.6 inch 25 L Casual Waterproof Laptop Backpack/Office Bag/School Bag/College Bag/Business Bag/Unisex Travel Backpack,https://www.amazon.in/Wesley-Milestone-Waterproof-Backpack-Business/dp/B07PLKV6D1/ref=sr_1_22?keywords=bags&qid=1679381395&sr=8-22,4.3,"12,341",473
28,"FUR JADEN Anti Theft Number Lock Backpack Bag with 15.6 Inch Laptop Compartment, USB Charging Port & Organizer Pocket for Men Women Boys Girls",https://www.amazon.in/Number-Backpack-Compartment-Charging-Organizer/dp/B09VTCNN75/ref=sr_1_23?keywords=bags&qid=1679381395&sr=8-23,3.9,"3,119",689
29,ADISA Laptop Backpack 31 Ltrs,https://www.amazon.in/ADISA-BP004-Weight-Casual-Backpack/dp/B07G3CG9FC/ref=sr_1_24?keywords=bags&qid=1679381395&sr=8-24,4.0,"9,083",499
30,Lunar's Comet 35L Water Resistant Travel Bagpack/College Backpack/School Bag/Office Bag/Business Backpack/Daypack for Men and Women with 1 Year Warranty,https://www.amazon.in/Lunars-Comet-Resistant-Casual-Backpack/dp/B07WNFN1XS/ref=sr_1_25?keywords=bags&qid=1679381395&sr=8-25,4.0,"12,983",799
31,"Safari Flash Casual Backpack, 26 ltr Water Resistant Travel Bags| Weight Polyester Bagpack for Men and Women, Spacious Shoulder Bag for College, Office, Travelling and Camping",https://www.amazon.in/Safari-Backpack-Resistant-Polyester-Travelling/dp/B09B29F66W/ref=sr_1_26?keywords=bags&qid=1679381395&sr=8-26,3.9,"2,428",799
32,"uppercase Medium 17 Ltrs Vegan Leather (upto 14 inch) Laptop Backpack 2300EBP1 3x more water resistant sustainable bags with rain proof zippers for Men, Women, Boys and Girls, 750 Days warranty",https://www.amazon.in/sspa/click?ie=UTF8&spc=MTozNDg2MzQwODEwNjczNzc0OjE2NzkzODEzOTU6c3BfbXRmOjIwMTI0MzExMDI0ODk4OjowOjo&url=%2Fuppercase-Backpack-2300EBP1-resistant-sustainable%2Fdp%2FB0BWNCV31F%2Fref%3Dsr_1_27_sspa%3Fkeywords%3Dbags%26qid%3D1679381395%26sr%3D8-27-spons%26sp_csd%3Dd2lkZ2V0TmFtZT1zcF9tdGY%26psc%3D1,New to Amazon,0,"1,600"
33,"uppercase Medium 23 Ltrs Tall Boy (14.6 inch) Laptop Backpack 2500EBP1 3x more water resistant sustainable bag with rain proof zippers for Men, Women, Boys and Girls, 750 Days warranty",https://www.amazon.in/sspa/click?ie=UTF8&spc=MTozNDg2MzQwODEwNjczNzc0OjE2NzkzODEzOTU6c3BfbXRmOjIwMDY1NTMzNjg0Njk4OjowOjo&url=%2FPOLICE-ltrs-cms-backpack-PTO020008_1_black%2Fdp%2FB0B81YTTWS%2Fref%3Dsr_1_28_sspa%3Fkeywords%3Dbags%26qid%3D1679381395%26sr%3D8-28-spons%26sp_csd%3Dd2lkZ2V0TmFtZT1zcF9tdGY%26psc%3D1,4.1,186,"1,700"
34,American Tourister Casual Backpack,https://www.amazon.in/American-Tourister-AMT-SCH-BAG01/dp/B07CJCFNZG/ref=sr_1_29?keywords=bags&qid=1679381395&sr=8-29,4.1,"14,461","1,139"
35,F Gear Luxur Brown 25 liter Laptop Backpack (2404),https://www.amazon.in/F-Gear-Luxur-Brown-Backpack/dp/B01F7AX9ZA/ref=sr_1_30?keywords=bags&qid=1679381395&sr=8-30,4.4,"16,463","1,032"
36,ADISA 35L Large Laptop Backpack Office Bag College Travel Back Pack with rain Cover (Green),https://www.amazon.in/ADISA-Laptop-Backpack-Office-College/dp/B0BPVCBFM7/ref=sr_1_31?keywords=bags&qid=1679381395&sr=8-31,4.0,31,599
37,"Mi Step Out 12 L Mini Backpack (Small Size, Dark Blue, Water Repellant)",https://www.amazon.in/Step-Backpack-Small-Water-Repellant/dp/B088XH1BP7/ref=sr_1_32?keywords=bags&qid=1679381395&sr=8-32,4.1,"8,155",299
38,TRAWOC 80L Travel Backpack for Men & Women Outdoor Sport Camp Hiking Trekking Bag Camping Rucksack,https://www.amazon.in/TRAWOC-Backpack-Trekking-Rucksack-Warranty/dp/B0847PGZZM/ref=sr_1_33?keywords=bags&qid=1679381395&sr=8-33,4.4,"6,925","2,380"
39,DEIN KLEIDER Men's Nylon Messenger Bag,https://www.amazon.in/Kleider-Travel-Business-Messenger-Shoulder/dp/B084ZHP97M/ref=sr_1_34?keywords=bags&qid=1679381395&sr=8-34,4.0,"4,564",349
40,"AirCase Laptop Bag Backpack Case Pouch for Laptop Backpack for Men & Women,Premium Vegan Leather",https://www.amazon.in/AirCase-C34-Laptop-Backpack-Women/dp/B07QN4KXWG/ref=sr_1_35?keywords=bags&qid=1679381395&sr=8-35,3.9,751,929
41,NIVIA Basic Duffle Polyester Bag/Gym Bags/Adjustable Shoulder Bag for Men/Duffle Gym Bags for Men/Fitness Bag/Carry Bags/Sports & Travel Bag/Sports Kit/Duffle Bags Travel,https://www.amazon.in/Nivia-6853-Polyester-Basic-Duffle/dp/B07FWQ9HRV/ref=sr_1_36?keywords=bags&qid=1679381395&sr=8-36,4.0,"3,114",239
42,Red Lemon Bange Hard Ironlook Briefcase Laptop Bag Anti-Theft Hard Shell Unisex Laptop Backpack with USB Charging Backpack for Men and Women,https://www.amazon.in/sspa/click?ie=UTF8&spc=MTozNDg2MzQwODEwNjczNzc0OjE2NzkzODEzOTU6c3BfYnRmOjIwMTI4MjU4Nzk2Njk4OjowOjo&url=%2FRed-Lemon-Ironlook-Briefcase-Anti-Theft%2Fdp%2FB09ZYMT7V1%2Fref%3Dsr_1_37_sspa%3Fkeywords%3Dbags%26qid%3D1679381395%26sr%3D8-37-spons%26sp_csd%3Dd2lkZ2V0TmFtZT1zcF9idGY%26psc%3D1,4.3,61,"4,599"
43,"uppercase Apex Professional Laptop Backpack (15.6 Inch) 3x more water resistant sustainable bags with rain proof zippers for Men, Women, Boys and Girls, 750 Days warranty",https://www.amazon.in/sspa/click?ie=UTF8&spc=MTozNDg2MzQwODEwNjczNzc0OjE2NzkzODEzOTU6c3BfYnRmOjIwMTA1NDUxODUxNTk4OjowOjo&url=%2Fuppercase-Professional-Backpack-resistant-sustainable%2Fdp%2FB0BR1D4SL1%2Fref%3Dsr_1_38_sspa%3Fkeywords%3Dbags%26qid%3D1679381395%26sr%3D8-38-spons%26sp_csd%3Dd2lkZ2V0TmFtZT1zcF9idGY%26psc%3D1,4.9,17,"1,800"
44,LOOKMUSTER Casual Waterproof Laptop Backpack/Office Bag/School Bag/College Bag/Business Bag/Travel Backpack,https://www.amazon.in/sspa/click?ie=UTF8&spc=MTo2NDgyNzA4OTA5OTMxODA3OjE2NzkzODEzOTY6c3BfYXRmX25leHQ6MjAxMjE0ODk2Mzg0OTg6OjA6Og&url=%2FLOOKMUSTER-Waterproof-Backpack-College-Business%2Fdp%2FB0BS6YGKMC%2Fref%3Dsr_1_33_sspa%3Fkeywords%3Dbags%26qid%3D1679381396%26sr%3D8-33-spons%26sp_csd%3Dd2lkZ2V0TmFtZT1zcF9hdGZfbmV4dA%26psc%3D1,5.0,2,528
45,"uppercase Medium 17 Ltrs Vegan Leather (upto 14 inch) Laptop Backpack 2300EBP1 3x more water resistant sustainable bags with rain proof zippers for Men, Women, Boys and Girls, 750 Days warranty",https://www.amazon.in/sspa/click?ie=UTF8&spc=MTo2NDgyNzA4OTA5OTMxODA3OjE2NzkzODEzOTY6c3BfYXRmX25leHQ6MjAxMjQzMTEwMjQ4OTg6OjA6Og&url=%2Fuppercase-Backpack-2300EBP1-resistant-sustainable%2Fdp%2FB0BWNCV31F%2Fref%3Dsr_1_34_sspa%3Fkeywords%3Dbags%26qid%3D1679381396%26sr%3D8-34-spons%26sp_csd%3Dd2lkZ2V0TmFtZT1zcF9hdGZfbmV4dA%26psc%3D1,New to Amazon,0,"1,600"
46,Tommy Hilfiger Joshua 15 inch 21 Ltrs Light Grey Laptop Backpack (TH/JOSHUALAP07),https://www.amazon.in/Hilfiger-Joshua-Backpack-TH-JOSHUALAP01/dp/B07N8GRWTZ/ref=sr_1_35?keywords=bags&qid=1679381396&sr=8-35,3.9,399,"2,239"
47,"Safari Quill Laptop Backpack 26 Ltrs Water Resistant Fabric - Blue, L (QUILL19CBBLU)",https://www.amazon.in/Safari-Laptop-Backpack-Resistant-Fabric/dp/B09B28TKLG/ref=sr_1_36?keywords=bags&qid=1679381396&sr=8-36,4.1,493,799
48,"Lenovo 15.6"" (39.62cm) Slim Everyday Backpack, Made in India, Compact, Water-resistant, Organized storage:Laptop sleeve,tablet pocket,front workstation,2-side pockets,Padded adjustable shoulder straps",https://www.amazon.in/Lenovo-15-6-Inches-Everyday-Backpack/dp/B08R7RPVJF/ref=sr_1_37?keywords=bags&qid=1679381396&sr=8-37,4.4,"2,724",652
49,"Dell Pro Slim Backpack 15 - PO1520PS - Fits Most laptops up to 38.1 cm (15 inches, Black)",https://www.amazon.in/Dell-Pro-Slim-Backpack-15/dp/B07PMQTB6T/ref=sr_1_38?keywords=bags&qid=1679381396&sr=8-38,4.3,397,"1,599"
50,"Tabelito® Casual Laptop Bag 15.6inch (39.6 cm) , 25 LTR Office College School Bags Business Travel Backpack for Men Women Water Resistant Bags(BLACK)",https://www.amazon.in/Tabelito-Laptop-Backpack-15-6-inch-Repellent/dp/B08Y5S6C2P/ref=sr_1_39?keywords=bags&qid=1679381396&sr=8-39,4.2,"1,597",549
51,Arctic Fox 15 Liters Draw String Bag Lavender Backpack,https://www.amazon.in/Arctic-Fox-Liters-String-Backpack/dp/B08L6Q9V1H/ref=sr_1_40?keywords=bags&qid=1679381396&sr=8-40,4.3,"2,947",222
52,Wesley Spartan Unisex Travel Hiking Laptop Bag fits Upto 17.3 inch with Raincover and Internal Organiser Backpack Rucksack College Bag,https://www.amazon.in/Wesley-Spartan-Hiking-Raincover-Organiser/dp/B098QFF5TJ/ref=sr_1_41?keywords=bags&qid=1679381396&sr=8-41,4.1,"1,044",790
53,AUXTER Faux Leather 23 Cms Duffle Bag(AUX_GB_LE_Black -SE_0521_Black),https://www.amazon.in/AUXTER-BLACKY-Duffel-Emboss-Black/dp/B07F2H25NP/ref=sr_1_42?keywords=bags&qid=1679381396&sr=8-42,4.3,"8,907",376
54,"EUME Propine Laptop Backpack | Built-in Massager, Water Resistant & Anti-Theft | Fits Up-to 15.6"" MacBook (Melange, 22L)",https://www.amazon.in/sspa/click?ie=UTF8&spc=MTo2NDgyNzA4OTA5OTMxODA3OjE2NzkzODEzOTY6c3BfbXRmOjIwMTIxOTcyMjYwNDk4OjowOjo&url=%2FEUME-Propine-Massager-Backpack-Charging%2Fdp%2FB07XG935R9%2Fref%3Dsr_1_43_sspa%3Fkeywords%3Dbags%26qid%3D1679381396%26sr%3D8-43-spons%26sp_csd%3Dd2lkZ2V0TmFtZT1zcF9tdGY%26psc%3D1%26smid%3DAPBFC7AMQ4Q38,4.1,45,"3,499"
55,"uppercase Medium 23 Ltrs Tall Boy (14.6 inch) Laptop Backpack 2500EBP1 3x more water resistant sustainable bag with rain proof zippers for Men, Women, Boys and Girls, 750 Days warranty",https://www.amazon.in/sspa/click?ie=UTF8&spc=MTo2NDgyNzA4OTA5OTMxODA3OjE2NzkzODEzOTY6c3BfbXRmOjIwMDY1NTMzNjg0Njk4OjowOjo&url=%2FPOLICE-ltrs-cms-backpack-PTO020008_1_black%2Fdp%2FB0B81YTTWS%2Fref%3Dsr_1_44_sspa%3Fkeywords%3Dbags%26qid%3D1679381396%26sr%3D8-44-spons%26sp_csd%3Dd2lkZ2V0TmFtZT1zcF9tdGY%26psc%3D1,4.1,186,"1,700"
56,VIP Polypropylene 48 Cms Travel Bag(DFENDEBRN_Brown),https://www.amazon.in/VIP-Endura-Puller-Brown-Duffle/dp/B0B527KJQZ/ref=sr_1_45?keywords=bags&qid=1679381396&sr=8-45,4.3,404,899
57,ADISA 15.6 inch Laptop Backpack Office Bag College Travel Back Pack 32 Ltrs (z-Black),https://www.amazon.in/ADISA-Laptop-Backpack-College-z-Black/dp/B09TPY1G1W/ref=sr_1_46?keywords=bags&qid=1679381396&sr=8-46,3.8,566,499
58,DZert Kids School Bag Soft Plush Backpacks Cartoon Boys Girls Baby (2-5 Years),https://www.amazon.in/DZert-Fabric-Multicolour-Spiderman-Printed/dp/B07BNS3KNX/ref=sr_1_47?keywords=bags&qid=1679381396&sr=8-47,3.8,"1,399",239
59,Lenovo Casual Laptop Backpack B210 15.6-inch(39.6cm) Water Repellent Black,https://www.amazon.in/Lenovo-Laptop-Backpack-15-6-Inch-GX40Q17225/dp/B075Y72PHZ/ref=sr_1_48?keywords=bags&qid=1679381396&sr=8-48,4.2,"54,725",799
60,F Gear Enzo Sports Waist Bag (.Black Blue),https://www.amazon.in/F-Gear-Enzo-Black-Blue-Waist-Bag/dp/B0862LXJYT/ref=sr_1_49?keywords=bags&qid=1679381396&sr=8-49,4.2,"1,111",200
61,"American Tourister VALEX BLACK LAPTOP BACKPACK 28 Ltrs,Volume, LAPTOP COMPARTMENT, BOTTLE POCKET, FRONT ORGANIZER",https://www.amazon.in/American-Tourister-BACKPACK-COMPARTMENT-ORGANIZER/dp/B0BTD4S4XF/ref=sr_1_50?keywords=bags&qid=1679381396&sr=8-50,4.1,8,"1,299"
62,Fur Jaden Anti Theft Backpack 15.6 Inch Laptop Bag with USB Charging Port,https://www.amazon.in/Fur-Jaden-Black-Waterproof-Backpack/dp/B078GLXMDY/ref=sr_1_51?keywords=bags&qid=1679381396&sr=8-51,4.0,"10,754",799
63,Zipline Unisex casual polyester 36 L Backpack School Bag Women Men Boys Girls children Daypack College Bag Book School Sports Bag Weekend Bag,https://www.amazon.in/ZIPLINE-Polyester-Backpack-Children-Daypack/dp/B07XVMR33Q/ref=sr_1_52?keywords=bags&qid=1679381396&sr=8-52,4.0,"5,130",834
64,"uppercase Apex Professional Laptop Backpack (15.6 Inch) 3x more water resistant sustainable bags with rain proof zippers for Men, Women, Boys and Girls, 750 Days warranty",https://www.amazon.in/sspa/click?ie=UTF8&spc=MTo2NDgyNzA4OTA5OTMxODA3OjE2NzkzODEzOTY6c3BfYnRmOjIwMTA1NDUxODUxNTk4OjowOjo&url=%2Fuppercase-Professional-Backpack-resistant-sustainable%2Fdp%2FB0BR1D4SL1%2Fref%3Dsr_1_53_sspa%3Fkeywords%3Dbags%26qid%3D1679381396%26sr%3D8-53-spons%26sp_csd%3Dd2lkZ2V0TmFtZT1zcF9idGY%26psc%3D1,4.9,17,"1,800"
65,"MOKOBARA Backpack 15.5"" Inch Laptop Backpack For Women (16 litres ) Improved (2022 - Model)",https://www.amazon.in/sspa/click?ie=UTF8&spc=MTo2NDgyNzA4OTA5OTMxODA3OjE2NzkzODEzOTY6c3BfYnRmOjIwMTE3Nzk1ODc2OTk4OjowOjo&url=%2FMOKOBARA-TSBPK12CND22001-Backpack-Modern-Love%2Fdp%2FB08T1769X9%2Fref%3Dsr_1_54_sspa%3Fkeywords%3Dbags%26qid%3D1679381396%26sr%3D8-54-spons%26sp_csd%3Dd2lkZ2V0TmFtZT1zcF9idGY%26psc%3D1%26smid%3DA2ZJIE4OXD710M,4.3,152,"4,499"
66,"uppercase Medium 17 Ltrs Vegan Leather (upto 14 inch) Laptop Backpack 2300EBP1 3x more water resistant sustainable bags with rain proof zippers for Men, Women, Boys and Girls, 750 Days warranty",https://www.amazon.in/sspa/click?ie=UTF8&spc=MTo3MDQyMTgyMDIzNzQ5MjI5OjE2NzkzODEzOTk6c3BfYXRmX25leHQ6MjAxMjQzMTEwMjQ4OTg6OjA6Og&url=%2Fuppercase-Backpack-2300EBP1-resistant-sustainable%2Fdp%2FB0BWNCV31F%2Fref%3Dsr_1_49_sspa%3Fkeywords%3Dbags%26qid%3D1679381399%26sr%3D8-49-spons%26sp_csd%3Dd2lkZ2V0TmFtZT1zcF9hdGZfbmV4dA%26psc%3D1,M.R.P: ,0,"1,600"
67,"EUME Propine Laptop Backpack | Built-in Massager, Water Resistant & Anti-Theft | Fits Up-to 15.6"" MacBook (Melange, 22L)",https://www.amazon.in/sspa/click?ie=UTF8&spc=MTo3MDQyMTgyMDIzNzQ5MjI5OjE2NzkzODEzOTk6c3BfYXRmX25leHQ6MjAxMjE5NzIyNjA0OTg6OjA6Og&url=%2FEUME-Propine-Massager-Backpack-Charging%2Fdp%2FB07XG935R9%2Fref%3Dsr_1_50_sspa%3Fkeywords%3Dbags%26qid%3D1679381399%26sr%3D8-50-spons%26sp_csd%3Dd2lkZ2V0TmFtZT1zcF9hdGZfbmV4dA%26psc%3D1%26smid%3DAPBFC7AMQ4Q38,4.1,45,"3,499"
68,American Tourister Casual Backpack,https://www.amazon.in/American-Tourister-AMT-SCH-BAG01/dp/B07CJCFNZG/ref=sr_1_51?keywords=bags&qid=1679381399&sr=8-51,4.1,"14,461","1,139"
69,Tommy Hilfiger Joshua 15 inch 21 Ltrs Light Grey Laptop Backpack (TH/JOSHUALAP07),https://www.amazon.in/Hilfiger-Joshua-Backpack-TH-JOSHUALAP01/dp/B07N8GRWTZ/ref=sr_1_52?keywords=bags&qid=1679381399&sr=8-52,3.9,399,"2,239"
70,Half Moon Large 37L Laptop Bag Backpack for menं Women Boys and Girls Luggage Travel Bags with 17.3 inches Laptop Compartment & Rain Cover,https://www.amazon.in/Half-Moon-Backpack-Compartment-Reflective/dp/B0BJ32LQ6X/ref=sr_1_53?keywords=bags&qid=1679381399&sr=8-53,3.9,"2,340",849
71,"Luv Lap Baby Breast Milk Storage Bags (Pack of 50), BPA Free Disposable Milk Freezer Bags for Breast Feeding, Transparent",https://www.amazon.in/Storage-Disposable-Freezer-Feeding-Transparent/dp/B099ZVTNCP/ref=sr_1_54?keywords=bags&qid=1679381399&sr=8-54,4.4,561,569
72,"Dell Pro Slim Backpack 15 - PO1520PS - Fits Most laptops up to 38.1 cm (15 inches, Black)",https://www.amazon.in/Dell-Pro-Slim-Backpack-15/dp/B07PMQTB6T/ref=sr_1_55?keywords=bags&qid=1679381399&sr=8-55,4.3,397,"1,599"
73,"Fur Jaden 15.6 Inch Laptop Backpack 25 LTR Bag for School, College and Office with USB Charging Port",https://www.amazon.in/Casual-Backpack-Charging-Laptop-Compartment/dp/B07J46KLFP/ref=sr_1_56?keywords=bags&qid=1679381399&sr=8-56,3.9,"9,938",489
74,Lenovo Casual Laptop Backpack B210 15.6-inch(39.6cm) Water Repellent Black,https://www.amazon.in/Lenovo-Laptop-Backpack-15-6-Inch-GX40Q17225/dp/B075Y72PHZ/ref=sr_1_57?keywords=bags&qid=1679381399&sr=8-57,4.2,"54,725",799
75,Bennett™ Mystic Unisex Adult Men's Laptop Bag 15.6 inch Side Shoulder Briefcase Satchel Messenger Business Bags for Men & Women Front Pocket for Laptop Accessories - Black (6 Month Warranty),https://www.amazon.in/BennettTM-Shoulder-Messenger-Repellent-Charcoal/dp/B09CV24TMK/ref=sr_1_58?keywords=bags&qid=1679381399&sr=8-58,4.1,"5,211",512
76,"uppercase Medium 23 Ltrs Tall Boy (14.6 inch) Laptop Backpack 2500EBP1 3x more water resistant sustainable bag with rain proof zippers for Men, Women, Boys and Girls, 750 Days warranty",https://www.amazon.in/sspa/click?ie=UTF8&spc=MTo3MDQyMTgyMDIzNzQ5MjI5OjE2NzkzODEzOTk6c3BfbXRmOjIwMDY1NTMzNjg0Njk4OjowOjo&url=%2FPOLICE-ltrs-cms-backpack-PTO020008_1_black%2Fdp%2FB0B81YTTWS%2Fref%3Dsr_1_59_sspa%3Fkeywords%3Dbags%26qid%3D1679381399%26sr%3D8-59-spons%26sp_csd%3Dd2lkZ2V0TmFtZT1zcF9tdGY%26psc%3D1,4.1,186,"1,700"
77,"uppercase Apex Professional Laptop Backpack (15.6 Inch) 3x more water resistant sustainable bags with rain proof zippers for Men, Women, Boys and Girls, 750 Days warranty",https://www.amazon.in/sspa/click?ie=UTF8&spc=MTo3MDQyMTgyMDIzNzQ5MjI5OjE2NzkzODEzOTk6c3BfbXRmOjIwMTA1NDUxODUxNTk4OjowOjo&url=%2Fuppercase-Professional-Backpack-resistant-sustainable%2Fdp%2FB0BR1D4SL1%2Fref%3Dsr_1_60_sspa%3Fkeywords%3Dbags%26qid%3D1679381399%26sr%3D8-60-spons%26sp_csd%3Dd2lkZ2V0TmFtZT1zcF9tdGY%26psc%3D1,4.9,17,"1,800"
78,TRAWOC 80L Travel Backpack for Men & Women Outdoor Sport Camp Hiking Trekking Bag Camping Rucksack,https://www.amazon.in/TRAWOC-Backpack-Trekking-Rucksack-Warranty/dp/B0847PGZZM/ref=sr_1_61?keywords=bags&qid=1679381399&sr=8-61,4.4,"6,925","2,380"
79,NIVIA Deflate Round 01 Polyester Gym Bag/Unisex Gym Bags/Adjustable Shoulder Bag for Men/Duffle Gym Bags for Men/Carry Gym Accessories/Fitness Bag/Sports &Travel Bag/Gym kit Bag,https://www.amazon.in/Nivia-Deflate-5180BK-Polyester-Round/dp/B07222KX3S/ref=sr_1_62?keywords=bags&qid=1679381399&sr=8-62,4.2,"7,268",449
80,Lunar's Bingo - 48 L Laptop Office/School/Travel/Business Backpack Water Resistant - Fits Up to 15.6 Inch Laptop Notebook with 1 Year Warranty,https://www.amazon.in/Lunars-Bingo-Laptop-Resistant-48L/dp/B08YZ5XY31/ref=sr_1_63?keywords=bags&qid=1679381399&sr=8-63,3.9,"9,046",899
81,"American Tourister VALEX BLACK LAPTOP BACKPACK 28 Ltrs,Volume, LAPTOP COMPARTMENT, BOTTLE POCKET, FRONT ORGANIZER",https://www.amazon.in/American-Tourister-BACKPACK-COMPARTMENT-ORGANIZER/dp/B0BTD4S4XF/ref=sr_1_64?keywords=bags&qid=1679381399&sr=8-64,4.1,8,"1,299"
